Title,Author,Date,Content
Still confused about Creatinine and GFR,MikeK703,2011-06-30T18:52:10+00:00,"This is a quote from the National Kidney Foundation website in answer to a question from somebody whose creatinine level was 1.58:""A creatinine level of 1.58 may be normal after removal of one kidney, especially if you are over 50 years of age. Removing one kidney always results in a decrease in total kidney function and an elevation in the creatinine test.""  Notice the ""always.""From MedicineNet.com:""A person with only one kidney may have a normal level of about 1.8 or 1.9."" Notice the ""normal.""My levels were normal before my radical nephrectomy and went bad immediately afterwards.  The above statements pretty much jibe with what my urologist told me -- that my creatinine readings (currently 1.5) and GFR readings (currently 47) are normal for somebody with one kidney.  Yet my nephrologist tells me I have chronic kidney disease (CKD), Stage 3. He is not ""alarmed"" but of course I am.  I told the nephrologist what my urologist said and what I had read online and he said, ""oh yes, that's true.""  But he still diagnosed me as having CKD and has ordered more blood tests at the end of July, which I don't have a problem with.  As a matter of fact, I like being monitored this closely.  But of course, I am confused.  I plan to discuss this with my urologist in my second followup visit in August.Thank you, Iceman, for sharing your results in my previous posting but I'd like to know how others' blood tests have gone since their surgeries.  If you don't mind, may I ask who else has had high creatinine/low GFR readings?  And if so, have you been told you have ""chronic kidney disease?"" Or have you been told that this is normal for your situation and nothing really to worry about?Thanks.Mike"
Complex Renal Cyst,Melanna,2024-10-22T14:22:01+00:00,"Hello All,I found this board a couple months ago when my dad was suddenly diagnosed with a mass on his kidney the size of a baseball. He had a nephrectomy and has been doing well since (pathology was RCC). I have been working to take care of my own body to ensure that if he ever needed a kidney, I would have one to spare. Well, after a recent ultrasound of my abdomen, it seems I have a multiloculated multiseptated cystic structure in the lower pole of the left kidney. It’s about 4x4x4. I’m in my 30’s, so a bit of a shock. I have a CT scheduled in two days, so now just a waiting game. Reading all of your experiences has been so helpful! What a great board for information and support! Thank you! ☺️"
8 years,stub1969,2024-08-07T22:48:12+00:00,"Hello again!  I had my scans yesterday and everything (kidney-wise) came back clear.  Just click on my icon to view my history.  They did see a little blip in my small intestine and will follow up with GI.   I'm glad to see ""Bay"", ""Donna"", ""Jazzgirl"", ""Lobbyist"" and others still providing wisdom and support.  Sorry, I've been gone for so long.  Life is just busy.   My youngest daughter just graduated from high school and was recruited to play basketball in college.   We'll be putting some miles on to watch her play:)"
Biggest incision swells,paulaf62,2024-11-10T15:45:09+00:00,"hi all,Had a partial nephrectomy 10/23, RCC clear stage 2, feeling pretty good at almost 3 weeks post op,  my concern in that my largest incision, one right below my left ribcage swells when I eat. I realize it’s right where my stomach and transverse colon is, could that be why?  Should I be concerned?  Anyone else have this? 
i see a lot of post from years ago, hope this board is still open"
Translocation RCC,nammu177,2024-10-26T15:38:32+00:00,"Hi all, My younger brother ( 33 yo) was recently diagnosed with a 20cm left kidney mass after having a cough for two months and then suddenly night sweats and weight loss in Sept 2024, underwent left open radical nephrectomy. The pathology report showed mixed cell types and spread to nearby lymph nodes. After 4 weeks another CT chest shows a new small growth in a supraclavicular lymph node and the biopsy was positive and last week they confirmed it was translocation RCC. He will be getting a combo immunotherapy treatment and I’m really hoping it responds. I wanted to see if anyone out there with similar experiences and how you were treated if stage 4 cancer  and recommendations for cancer centers for a second opinion especially this is a rare subtype . I tried to call MD Anderson and Memorial Sloan but they will not do telehealth for patients in CA. His current doctor seems to be great but because this is rare, I feel another opinion would help or if both docs can collaborate. Thank you!"
My experience after having a Laparoscopic  Partial Nephrectomy,sunny1234,2023-11-16T15:35:19+00:00,"I had my surgery 2weeks ago. This is what i experienced, Remember we are all different.On day one was stay was in hospital day 2 went home. Wow pain for the first few days was pretty ripe no laughing deep breathing coughing sneezing or yawning. My Shoulders hurt.  Did not really eat the first few day slowly started to eat no appetite in the first week, i have only just recently started to eat normal.  On day three i was able to just take Tylenol for my pain during the day as it slowly got better. I went for a 1/4 mile walk  i was very tired afterward.    For 4 nights at bedtime  i would take the pain med so i could sleep.  Day five i stopped night time pain med do to no bowel movement I only took Tylenol.   I Was taking Colace from day one, I added Miralax on day 3 took me almost 8 days before i moved my bowels.  Everyday i get a little better but my energy, being able to move quickly is only at 60% .  I still get tired after my walks and doing to many things.  On day 6 oh boy the itching began it got so bad that i had to take Benedryl every three hours for about 4 days. I still take benedryl but not as much. The itching can get very intense. I have my good days and my bad ones meaning some days i feel almost normal and then there are days when i feel completely tired. I know that this will all get better in time. I am very happy that i can go on my walks everyday.  Things you may want to have in your house after surgery is benedryl or zurtex for itching Tylenol for pain and a laxative.  I still do not know my results from the pathology report i guess i will find out at the end of the month when i finally see my Doctor. I will be updating this post for a while . What i also found helpful in the beginning was to press a pillow against my stomach in case i cough sneezed or laughed. at night i kept a pillow on my stomach to prevent me from opening the incisions do to severe itching.Has anyone used a anti itch topical after 2 weeks? I Truly appreciate any feedback to help make my days go by a little easier the itching is just torment..Sunny."
Tumor is back,Mick182,2024-10-24T02:11:55+00:00,"They found tumors on my left kidney in 2016 and performed a partial left nephrectomy. They’re back. Now they’re removing the entire kidney.
My doctor hates me. They scheduled the procedure for March. I called once to ask if I could get an earlier date. I was worried it would spread. 
I went in to talk to my doctor in person. He called me a “big fatty.” He said he’d schedule dates for Black Friday because he “hates his family anyway.” Kept complaining about the hospital and having to talk to patients rather than operate: I don’t trust him now but what options do I have. If I try to get another doctor the cancer could spread between now and whenever that new doctor schedules surgery.
I feel more alone than ever."
Stage 4 RCC that has metastasized,dez300,2024-10-28T21:23:14+00:00,"My 82yr old Mom was diagnosed with Stage 4 Kidney Cancer that has metastasized in her ribs, liver and spine. Prior to finding out she was living a normal lifestyle at her age and this has been quite a shock. By the time we were figured out what DR’s we need to see and all the tests we are now almost 4mo’s into this and so confused and scared. She started an infusion and had 2 treatments along with a pill treatment which is she is having side effects from so they took her off it.  Eating, pains and strength all are not tolerable and the meds they give her are not working so great and she says all that works with the Pain is Advil.  I am a loss on how to help her and my heart is breaking for her! I need some resources and advice to how to manage this and help her to eat, she is so nauseous and bad taste. We give her Boost and sometimes she can hold some food down but most days she can’t even eat.Her treatment plan was: Opdivo Infusions every 28days and Cabometyx pill every day!"
Cabometyx side effects,twolabs,2024-11-07T22:39:17+00:00,"hi I’m new here. My husband has been living with RCC for seven years. He had kidney removed and at the time they found spots in his lungs.  Spots were slow growing so for most of that time he has been symptom free. But over the last year cancer has spread to other areas and tumors in lungs are larger.  He was put on Cabo recently after having tried immunotherapy which caused him to develop chronic pancreatitis. Cabo has had side effects for him and I am wondering if anyone has tips on how they manage the side effects of this drug. For him it’s mainly nausea, fatigue, pain in solar plexus which could actually be the pancreatitis. Considering taking only for 5 days and giving a break of two days. Or taking at night instead of am.  Trying to help him find ways to tolerate this better. Thanks in advance."
"Almost 6years RCC free, but my Dad has level 12 PSA BPH",StephAmbler85,2024-10-16T05:06:58+00:00,"Ok... I had CC RCC and open partial nephrectomy back In Jan of 2018. Found out I have MITF gene mutation which causes melanoma and RCC. I was dx at 32 yrs with 3.2 cm CC RCC on my Right kidney lower pole. Anyway, melanoma runs in my family along with lung, esophageal, pancreatic, ovarian, and other skin cancers. My Dad is 74 with BPH, and his father had the same with no cancer. My mom passed at 54 from esophageal cancer but from alcohol and smoking cigarettes. My dad's mom had ovarian cancer and died in her 50's a few months before I was born in 1985. Anyone know of any connection with MITF gene mutation and Prostate cancer? My dad is at a 12.  50% chance of getting it. And seems like he has beginning Alzheimer's at the young age of 74. Started memory issues at 65ish ."
Pt1b ccRCC in Nov 23 & (pre-existing) Thyroid nodule,Michael7,2024-09-22T17:02:17+00:00,"My father underwent a partial nephrectomy last November. The pathology report showed a pT1b Fuhrmangrade II tumor, measuring 4.2 cm. Right after surgery, another CT scan of the abdomen and thorax was done (also before surgery; everything clear with just a small 4 mm lung nodule), and the radiologist noted a 15 mm hypodense lesion in the thyroid but didn’t give much additional information. From what I’ve read, CT imaging doesn’t provide much insight into thyroid nodules and I'm getting more and more crazy as I go down every rabbit hole as a researcher myself.Recently, my father asked our family doctor to take another look using ultrasound, and he found 1-2 hypoechoic nodules (likely cold nodules), which supposedly haven’t changed in size. He suggested I see an endocrinologist for further tests, such as a scintigraphy.Now, after googling, of course, I came across all the worst-case scenarios, including the rare cases of RCCclear cell metastasis to the thyroid. From what I’ve seen, this happens after a significant delay, sometimes even 10 years post-surgery, and only a few hundred cases have been documented.What concerns me is that studies highlight how difficult it is to diagnose these thyroid metastases in patients with a non-thyroid cancer history—especially RCC, which apparently makes up 50% of the rare thyroid metastasis cases. Even biopsies can be misleading.Has anyone here experienced something similar or also have (cold) nodules ? I’ve seen cases online where doctors aren’t immediately worried and just keep monitoring the nodules. However, studies also emphasize that someone with a history of RCC should always be checked thoroughly for metastasis and I'm afraid of misdiagnosis. Even afraid that Pt1b is in doubt.Example for a study:

        https://jmedicalcasereports.biomedcentral.com/articles/10.1186/1752-1947-7-265"
Hello,juparoni,2024-08-23T17:45:35+00:00,"In January of 2024 I was in an automobile accident.  I had a broken back, and my tumor was an incidental find while they did an MRI on my right kidney, and was 1.25 CM. 
I had to heal from my broken back before beginning this journey.In my surgical evaluation in My, the tumor had grown to 4 CM.The plan was for a partial nephrectomy via robotic surgery at the end of July.My surgery had to postponed to August 7th. So after I got out of surgery, and in my post op follow up I learned that the tumor had grown to 7CM from May until then, and they had to do a full nephrectomy.I compartmentalized the emotions, and now find myself on a rollercoaster of emotions.My dr said that my odds are favorable for this to not reoccur, but I know that it is possible.I don’t know how to emotionally process any of this.How did you move through the emotional aspects of having Cancer.I feel really scared."
Strong in Faith yet still falling apart...,MjM777,2024-09-19T04:22:37+00:00,"Falling apart but faith is strong. Having a hard time accepting the ""5 year"" survival rate diagnosis of my dear loved one, He was diagnosed with Kidney cancer and after removal of kidney tehy found at his next scan it has spread to his lungs (was found quickly) but already on both lungs. So far he just finished is 3rd round of Chemo last friday and 4th round and scans will be on his bday on Oct 4th. My faith knows that he can be healed and the healing has already begun... just wanting to hear a few positive outcomes or stories of over 5 year survivals or Maricals and prayers... because the last thing I should do is google this horrible prognosis. looking for more strength and positive stories. Forever is not long enough for this amazing person. Many prayers and blessings to all in this group."
Hypoechoic Kidney Lesion,rwomack00,2024-09-12T20:50:43+00:00,"Hi everyone,A little background info about myself, I’m 31 years old. I started having upper and mid right abdominal pain last October so I’ve been seeing a gastro fairly regularly to find a cause to my pain. A month ago, I went for ovary pain and my gyno requested an ultrasound. Lo and behold they found this lesion on my right kidney. It is a 2.1 x 2.4 x 2.6 hypoechoic lesion with no calcification. I was told not to worry that it could be a cyst but I was being referred to a nephrologist who was going to perform further testing. My appointment isn’t until the end of October but I’ve stressed myself out by doing my own research. Apparently, only 20-30% of these solid masses are benign. I know I don’t have concrete info due to not speaking with the doctor but I’m scared. I feel like my pain may not have been gastro after all. Has anyone else had anything similar? What questions should I bring up at my appointment?"
"Keytruda, ChRCC, pT3a, pNO(0/8), LO, V1, RO, two doctors, two opposing recommendations",Tumourhumour,2023-10-28T18:56:22+00:00,"Hi everyone,I need help making a decision.The tumourboards recommendation: one year Keytruda on account of my young age, size of tumour, a lack of studies showing no/negative impact of Keytruda on ChRCC and Keytruda being the only available adjuvant treatment.The oncologists recommendation: no therapy with Keytruda on account of a lack of studies showing a positive impact of Keytruda on ChRCC and possible side effects. What do I do?I know ChRCC is rare, I know of all available studies, I understand where both recommendations come from, I understand possible risks and side effects but I am neither an oncologist nor a member of a tumourboard so how am I expected to make an informed and life-changing decision?  I don't know what to do."
Kidney confusion,dmaikui,2024-06-21T17:57:28+00:00,So will they just do another scan in 6 months do you think? Thank you
Keytruda immunotherapy,ktrett03,2024-02-25T21:04:13+00:00,Has anyone had experience with Keytruda infusions? My first infusion is this Friday. Any tips on what to bring/expect? My regimen is planned for every 3 weeks for a year currently.
New here and scared,klarsen316a,2024-06-26T20:54:07+00:00,"Hello, my name is Kim and I was very recently diagnosed with stage 4 kidney cancer.  I have a 12cm mass on my right kidney.  I donated my left kidney to my sister back in 2003 (she’s still doing great!).  They also found nodules on both lungs but they didn’t light up on the PET scan.  I will be going for an educational class regarding treatment.  They are giving me Inlyta 5 mg twice per day and immunotherapy, I believe no-weekly.  I haven’t started yet.  I also have my biopsy on the kidney on 7/8/24.  I’m very nervous and scared.  But I also am being positive.  I live alone with my dog, but I do have friends close by and my sister is about an hour away.  My son lives in Virginia so he’s very worried about me as well and wants me to go live with him and his family…. I guess I take this day by day and see how it goes."
Advice On Home Medical Equipment Required For Recovery,sunnyboy,2024-08-13T15:20:01+00:00,Hello all you courageous and fierce cancer fighters. My elderly father is going in for a radical nephrectomy and I’m taking time off to care for him after he is released from the hospital.My question is what home medical equipment would you recommend I purchase to make the recovery slightly more comfortable? Things I’m considering :Bed rail for grabbing onto to help get up out of bedwalkertoilet seat safety bars for easier lowering onto seat shower chair flexible shower head for hand held rinsing in showerMany thanks in advance.
"""Translocation"" RCC",RandaLeigh,2014-04-04T17:11:41+00:00,"I received a phone call from my Drs office this week stating thet were performing more tests and stains on the mass they removed from my kidney. Originally I was told it was clear cell now they are saying it may be ""translocation."" type. This has me very worried based on what I've read about this type of cancer. Anyone ever dealt with this?"
"Ultrasound shows one thing, CT scan does not.",Ann24,2022-01-31T04:01:48+00:00,"I had a ultrasound that showed a 2 CM mass  on my left kidney suspicious of neoplasm. My doctor called and told me it looked highly suspicious for kidney cancer and she would refer me to a surgeon, but first I needed a CT. I had a CT with contrast and is showed no mass on my left kidney. Which is great news, but is a CT always right? I have a history of Kidney cancer in my family and my husband had cancer so I don't take it lightly. I don't know if this is something I should still follow or just forget. I called my doctor, but have not heard from her in almost a week."
How to overcome fear of losing your spouse?,gauchayshunk,2023-09-23T17:31:07+00:00,"Hi, kidney cancer family. My wife's story is a unique one. She found out about her kidney cancer in May of this year and by July she had a full nephrectomy of her right kidney.  After analyzing the stage 3 tumor, the surgeon said there is no evidence of spread and that they were able to completely remove the cancer. He gives her a less than 10% chance of recurrence.   So from the time we knew about the cancer to the time there is no cancer is less than two months.  But those two months were hell on earth, and I spent the whole time wondering if I was going to lose my soulmate, the mother of my 3 sons, and be left alone to keep our family moving forward.All signs now indicate that the chances of that are very small. But I can't get my brain and my heart to believe it. I am still constantly worried that my wife is going to die, and it is causing me major anxiety. I have been in to see a therapist, which has definitely been helping. But I'd like to hear from others that have gone through what I'm going through. How do you get past the anxiety of wondering if your spouse is going to die, even when it's no longer likely? My brain says that since there is a chance it will come back, that it's likely going to happen.I am desperate for any help and solace. I can't be the husband my wife needs and the father my sons need if I'm constantly anxious about my future.Thank you."
New Here - what comes next...,Matt06870,2024-08-05T15:38:08+00:00,"Hi, I have been reading and just wanted to say hello. 5 years ago the urologist found ""something"" on my kidney. The oncologist reviewed and said its quite small, no interference with kidney function lets monitor. Fast forward to March 2024 my MRI came back with 3cm Clear Cell Renal Carcinoma. Of course this stopped me on a dime. There was no evidence that it had spread (thankfully). July 1 of 2024 under went a Robotic assisted partial nephrectomy. According to the pathology reports they got it all. The challenge(s) I am facing are post surgery. Nobody knew that I had cancer. I went into the hospital on Monday of a holiday week, walked out on Wed apparently cancer free as though nothing happened… nothing changed. In reality everything has changed  - I am still recovering internally, not to mention the mood swings from March - until  July were off the chart from depression to thankful it was caught. Post July 1 my entire life changed, but to those around me, family, work etc, it's  just another day. Much like going to the dentist or something. I can't seem to  focus on anything, I'm irritable and just feel like screaming ""do you have any idea what I have and am going through?"" but what I'm going through is mental, not physical so the understanding from my community isn't there. I'm expected to be the same person - I'm not - has anyone else gone through something similar?and yes - before recommending - I do have a therapist who has been with me from the beginning. Appreciate any input/assistance Matt"
cryoablation for RCC kidney cancer,candoredo,2011-05-18T10:49:00+00:00,"Does anyone know or had Cryoablation for RCC Kidney cancer on tumors smaller than 4 cm, in Texas.  This is my second one in 3 years they removed the first one open type surgery. but my health isnt as good now as it was then. I understand that this is a better option for me. I would appreciate other views on this."
Just looking for support. Anxiety level = 1000,monnocco,2024-01-29T16:13:15+00:00,"I'm a 44 year old male. I was in Argentina (my home country) on vacation and the last day I had a horrible pain on my lower back. I went to the ER d after an all day stay and lots of meds, they told me they found kidney stones. The ER doctor seriously recommended seeing an Urologist when I return to the US because there were two ""cysts"" on my kidney (one in each 3.7cm on the right, and 2.5cm on the left). My urologist considered it an ""incidental finding"". A couple months later (Sept 2023) I had a partial Nephrectomy on my right kidney with a ""clear margin"" result. I was so happy! No chemo or anything else needed.But the follow up visit (in two weeks) is to see the left kidney's ""cyst"". The doctor thinks it has a blood supply and most likely will have to be removed.I do not have children, but I am married, and I keep thinking I am going to die. I keep having anxiety and I keep finding myself fighting fears all day long. I've been going to therapy for a couple of years for other issues and she is amazing, but I feel like that is not helping me with this. I have the need to talk to other people who have been thru the same thing or similar.I am actively looking for a cancer support group in person, but it is hard to find. I live in Jersey City, NJ, but they seem to be far from me. Weird.Reading some of your stories and concerns makes me feel understood.#F-Cancer!"
3 years NED,Tobi,2024-06-19T18:25:00+00:00,"Haven't checked in for a bit, but I wanted to update everyone. Just had my 3 yr check up and NED. I am not expecting it to come back as it was stage 1a and grade 1, but it still feels good to hear him say what we were expecting. The doc has kicked me out to yearly visits instead of 6mo and life continues. I just want to say to any new person who may read this. The beginning is scary as hell. I am not going to lie it was hands down one of the worst periods of my life. My best advice is try to keep the stress at bay, it makes it easier to focus on what you need to do and what the doctor is telling you. I had the worst time putting my emotional brain aside so I could focus on my logical brain. It's odd but it all seems so far away now. Anyways, still going strong and I should be kicked out by my doc around 5 yrs, so just going to keep plodding along!"
I am a 35 year wilms tumor survivor,joseph38,2004-02-15T22:11:08+00:00,"Hello Folks, I am a 35 year wilms tumor survivor. I had my left kidney taken out when I was 2 1/2 years old. On Tuesday of I will be 38 years old. I am doing great. Would like to know if there are any other wilms tumor survivor here. Thankyou"
New to group,Thomasian,2023-12-22T16:58:27+00:00,"I’m Nancy from Chicago. A 2cm solid mass was found on my kidney by CT scan, incidentally. During the past 6 months my creatine has increased to 1.3 and my GFR to 47 with trace protein in my urine. We were keeping an eye on it. I have a history of Hurtle Cell Carcinoma of the thyroid 5 years ago with my thyroid being completely removed. I’m guessing that this would be a secondary cancer. I am assuming that this is cancer, with the question of how serious. I have an appointment with a Urologist in a month. Thoughts?"
